{
  "frontmatter": {
    "id": "v1.c06.l02",
    "schema_version": 1,
    "title": {
      "sa": "संवादः",
      "sa_iast": "saṃvādaḥ",
      "hi": "संवाद — पहली बातचीत",
      "en": "The First Dialogue"
    },
    "volume": 1,
    "chapter": 6,
    "lesson": 2,
    "lesson_type": "conversation",
    "cefr": "A1",
    "duration_minutes": 45,
    "self_study_minutes": 30,
    "prerequisites": [
      "v1.c06.l01"
    ],
    "review_of": [
      "v1.c05.l01",
      "v1.c05.l02"
    ],
    "objectives": [
      {
        "en": "Introduce yourself in Sanskrit with both frames — अहम् … अस्मि and मम नाम … — using your own name.",
        "hi": "अपने नाम के साथ दोनों साँचों — अहम् … अस्मि और मम नाम … — से संस्कृत में अपना परिचय दें।"
      },
      {
        "en": "Ask and answer the three introduction questions तव नाम किम्?, त्वम् कः? / त्वम् का?, and त्वम् अपि छात्रः? with the right question tune.",
        "hi": "परिचय के तीन प्रश्न — तव नाम किम्?, त्वम् कः? / त्वम् का?, त्वम् अपि छात्रः? — सही सुर में पूछें और उनके उत्तर दें।"
      },
      {
        "en": "Play the एतत् किम्? pointing game with known nouns (जलम्, मित्रम्, हिमम्).",
        "hi": "एतत् किम्? वाला इशारा-खेल जाने-पहचाने शब्दों (जलम्, मित्रम्, हिमम्) से खेलें।"
      },
      {
        "en": "Read the lesson's seven words and perform the two-scene dialogue in pause form, turn by turn.",
        "hi": "पाठ के सातों शब्द पढ़ें और दो दृश्यों का संवाद ठहराव-रूप में, बारी-बारी बोलकर, प्रस्तुत करें।"
      }
    ],
    "new_letters": [],
    "new_matras": [],
    "vocabulary_count": 7,
    "media": {
      "images": [
        "planned:assets/images/volume-1/v1c06l02-dialogue-cards.svg"
      ],
      "audio": [
        "planned:assets/audio/volume-1/v1c06l02-dialogue.mp3",
        "planned:assets/audio/volume-1/v1c06l02-word-list.mp3"
      ],
      "diagrams": [],
      "worksheets": [
        "planned:assets/worksheets/volume-1/v1c06l02-roleplay.pdf"
      ],
      "quizzes": []
    },
    "tags": [
      "conversation",
      "dialogue",
      "self-introduction",
      "questions",
      "milestone"
    ],
    "status": "reviewed",
    "version": "0.1.0",
    "authors": [
      "Sanskritam Editorial"
    ],
    "reviewers": [
      "Editorial review passes A–D, 2026-07-31"
    ],
    "created": "2026-07-31",
    "updated": "2026-07-31"
  },
  "sections": [
    {
      "index": 1,
      "name": "Hook",
      "anchor": "1-hook",
      "markdown": "Every conversation this course has printed came with a script: रामः spoke, the boy laughed,\nyou watched from outside. Today's central question breaks the pattern. तव नाम किम्? — \"what\nis your name?\" — is a question whose right answer appears nowhere in this book.\nOnly you can supply it. And one debt comes due: since the very first lesson, a girl named\nMaya has been waiting on a page she asked you a question from — a question the course could\nprint only in English. Today you answer her in Sanskrit."
    },
    {
      "index": 2,
      "name": "Learning Objective",
      "anchor": "2-learning-objective",
      "markdown": "इस पाठ के अन्त में आप यह कर सकेंगे —\n\n| # | Can-do (en) | आप कर सकेंगे (hi) |\n|---|---|---|\n| 1 | Introduce yourself in Sanskrit with both frames — अहम् … अस्मि and मम नाम … — using your own name. | अपने नाम के साथ दोनों साँचों — अहम् … अस्मि और मम नाम … — से संस्कृत में अपना परिचय दें। |\n| 2 | Ask and answer the three introduction questions तव नाम किम्?, त्वम् कः? / त्वम् का?, and त्वम् अपि छात्रः? with the right question tune. | परिचय के तीन प्रश्न — तव नाम किम्?, त्वम् कः? / त्वम् का?, त्वम् अपि छात्रः? — सही सुर में पूछें और उनके उत्तर दें। |\n| 3 | Play the एतत् किम्? pointing game with known nouns (जलम्, मित्रम्, हिमम्). | एतत् किम्? वाला इशारा-खेल जाने-पहचाने शब्दों (जलम्, मित्रम्, हिमम्) से खेलें। |\n| 4 | Read the lesson's seven words and perform the two-scene dialogue in pause form, turn by turn. | पाठ के सातों शब्द पढ़ें और दो दृश्यों का संवाद ठहराव-रूप में, बारी-बारी बोलकर, प्रस्तुत करें। |\n\nObjective 1 is built in §8 and tested in §18 (exercises 1, 4) and §19 (Q2, Q4); objective 2\nin §8–§9, §18 (exercises 2, 3), §19 (Q1, Q5, Q7); objective 3 in §8, §18 (exercise 5), §19\n(Q6); objective 4 in §14, §16, §18 (exercises 3, 6), §19 (Q3, Q8)."
    },
    {
      "index": 3,
      "name": "Previous Lesson Review",
      "anchor": "3-previous-lesson-review",
      "markdown": "पिछले पाठों की पुनरावृत्ति — answer from memory *before* looking anything up.\n\n1. **Write from memory** (self-dictation): अहम्. Which sign closes it, and what does that\n   sign do?\n2. Read cold and gloss: अहम् बालकः अस्मि। — which word is glossed whole, and what do we\n   refuse to explain about it until Volume 2?\n3. The polite question from the snow-abode dialogue: भवान् कः? — to whom is it said?\n   Answer it as yourself.\n4. Translate both ways, cold: किम् तत्? — तत् हिमम्।\n5. मित्रम् अत्र अस्ति? — nothing on the page marks this as a question. What does?\n6. **Lesson 1's one-day re-runs** (v1.c06.l01 §20): re-take its dictation cold — eight long\n   words from its dictation track, classical spelling — then one timed count-race circuit\n   (l01 exercise 4), logged beside yesterday's time.\n\n<details><summary>उत्तराणि · Answers</summary>\n\n1. अहम् (aham) \"I\" — the virāma ्, Law 5's vowel-killer: the final म् is bare /m/.\n2. अस्मि (asmi) \"I am\" — glossed whole like every verb so far; how it conjugates is\n   Volume 2's verb chapter's business (v2.c04), and we do not smuggle it in early.\n3. Said respectfully to a man — in Chapter 5's snow-abode dialogue, Rāma and the गुरुः\n   ask it of each other. Answer frame: अहम् + your name, or अहम् … अस्मि.\n4. \"What is that?\" — \"That is snow.\" किम् asks; तत् is its answer partner.\n5. The rising tune alone — a habit since Chapter 3's घटः अत्र अस्ति?\n6. Check spellings against l01 §14: ङ before the k-row (गङ्गा, अङ्गम्, सङ्घः), ञ before च\n   (पञ्च), the dot before स (संस्कृतम्). Block counts per l01 exercise 4: हिमालयः 4 ·\n   संस्कृतम् 4 · वर्णमाला 4 · विद्यालयः 4 · रामायणम् 5 · देवनागरी 5 · उपनिषद् 5 ·\n   महाभारतम् 6.\n</details>"
    },
    {
      "index": 4,
      "name": "Historical Context",
      "anchor": "4-historical-context",
      "markdown": "ऐतिहासिक सन्दर्भः — the oldest genre in the language.\n\nToday's संज्ञा names the lesson: **संवादः** (saṃvādaḥ) \"dialogue\". Take it apart and you\nfind an old friend — the वद् of वदति \"speaks\" and वदामि \"I speak\", which you have been\nreading since Chapters 4 and 5, now wearing सम् \"together\". A dialogue is, literally, a\nspeaking-together.\n\n> **[FACT · तथ्यम्]** संवादः is built from सम् \"together\" + वादः \"speech, speaking\":\n> conversation as joint speech. The root is the same वद् that gives वदति and वदामि.\n> [REF:apte1890 s.v. संवाद]\n\n> **[HISTORY · इतिहासः]** Dialogue is not a late luxury of Sanskrit literature — it is one\n> of its oldest layers. The Ṛgveda, composed c. 1500–1200 BCE on the scholarly consensus\n> dating [REF:jamison2014 p.5], already contains hymns cast entirely as exchanges between\n> two speakers, with no narrator at all — the Yama–Yamī hymn (10.10) is one.\n> [REF:rigveda 10.10]\n\n> **[TRADITION · परम्परा]** The tradition's great teaching texts keep that form: the\n> Upaniṣads stage instruction as question and answer between student and teacher, and the\n> Bhagavad Gītā describes itself as धर्म्यं संवादम् (dharmyaṃ saṃvādam) — \"a dialogue\n> concerning dharma\" — in its own closing chapter. [REF:bhagavadgita 18.70]\n\nYour two small scenes today stand at the head of that long road: someone asks, someone\nanswers, and the language happens between them."
    },
    {
      "index": 5,
      "name": "Scientific Explanation",
      "anchor": "5-scientific-explanation",
      "markdown": "वैज्ञानिक व्याख्या — why frames come before grammar.\n\nमम नाम …। is what language pedagogy calls a **formulaic chunk**: a fixed frame learned as\na whole, with one open slot. You will use it correctly today without knowing what the -म\nof मम does or why नाम looks the way it does — exactly as you have used वदामि and अस्मि\nwhole since Chapter 5 — as every verb has been glossed whole since Chapter 3.\n\n> **[FACT · तथ्यम्]** Learning high-frequency conversational frames as unanalyzed wholes —\n> chunks — is a standard, well-supported route into speaking: the frame becomes usable at\n> once, fluency builds on known material, and the internal grammar is unpacked later\n> without relearning. [REF:nation2013]\n\nTwo more design notes, honestly stated. First, everything in today's dialogue is built\nfrom words you already read — that is the bootcamp principle: fluency grows by running\n*known* material at speed, not by piling on new material [REF:nation2013]. Second, every\nrun through the scenes is retrieval practice — you produce the frames from memory, which\nbeats re-reading for long-term retention [REF:roediger2006]. And one delivery fact for §9: when\na sentence carries a question word (किम्, कः, का), the word itself does the asking; when\nit carries none — त्वम् अपि छात्रः? — the rising tune alone turns statement into question,\nas it has in this course since Chapter 3."
    },
    {
      "index": 6,
      "name": "Sanskrit Explanation",
      "anchor": "6-sanskrit-explanation",